<?xml version="1.0" encoding="UTF-8"?>
    <!DOCTYPE Family SYSTEM "Family.dtd">



<Family>
  <Members>
    <name> Bhaia   </name> 
    <gifts> Panjabi  </gifts> 
       
  </Members>  
    
    
  <Members>
    <name>Rezaul Bhaia   </name> 
    <gifts> Shirt  </gifts> 
       
  </Members>  
      
  <Members>
    <name> Tashbeed   </name> 
    <gifts> T-shirt  </gifts> 
       
  </Members>  
      
   <Members>
    <name> Hashi   </name> 
    <gifts> Salwar-kamij  </gifts> 
       
  </Members>  
     
   <Members>
    <name> Tahzeeb   </name> 
    <gifts> Scurt  </gifts> 
       
  </Members>  
     
</Family>
